[
  {
    "schema_version": "1.0.0",
    "id": "plant:acacia",
    "name": "Acacia",
    "normalized_name": "acacia",
    "source_dataset_id": "kaggle:aribashafaqat/plants-growth-and-care-recommendations",
    "source_row_numbers": [
      393
    ],
    "review_status": "dataset_accepted",
    "evidence_level": "single_dataset_claim"
  },
  {
    "schema_version": "1.0.0",
    "id": "plant:acalypha",
    "name": "Acalypha",
    "normalized_name": "acalypha",
    "source_dataset_id": "kaggle:aribashafaqat/plants-growth-and-care-recommendations",
    "source_row_numbers": [
      219
    ],
    "review_status": "dataset_accepted",
    "evidence_level": "single_dataset_claim"
  },
  {
    "schema_version": "1.0.0",
    "id": "plant:acanthus",
    "name": "Acanthus",
    "normalized_name": "acanthus",
    "source_dataset_id": "kaggle:aribashafaqat/plants-growth-and-care-recommendations",
    "source_row_numbers": [
      394
    ],
    "review_status": "dataset_accepted",
    "evidence_level": "single_dataset_claim"
  },
  {
    "schema_version": "1.0.0",
    "id": "plant:achillea_yarrow",
    "name": "Achillea (Yarrow)",
    "normalized_name": "achillea (yarrow)",
    "source_dataset_id": "kaggle:aribashafaqat/plants-growth-and-care-recommendations",
    "source_row_numbers": [
      548
    ],
    "review_status": "dataset_accepted",
    "evidence_level": "single_dataset_claim"
  },
  {
    "schema_version": "1.0.0",
    "id": "plant:acorn_squash",
    "name": "Acorn Squash",
    "normalized_name": "acorn squash",
    "source_dataset_id": "kaggle:aribashafaqat/plants-growth-and-care-recommendations",
    "source_row_numbers": [
      343
    ],
    "review_status": "dataset_accepted",
    "evidence_level": "single_dataset_claim"
  },
  {
    "schema_version": "1.0.0",
    "id": "plant:aloe_vera",
    "name": "Aloe Vera",
    "normalized_name": "aloe vera",
    "source_dataset_id": "kaggle:aribashafaqat/plants-growth-and-care-recommendations",
    "source_row_numbers": [
      2
    ],
    "review_status": "dataset_accepted",
    "evidence_level": "single_dataset_claim"
  },
  {
    "schema_version": "1.0.0",
    "id": "plant:alstroemeria",
    "name": "Alstroemeria",
    "normalized_name": "alstroemeria",
    "source_dataset_id": "kaggle:aribashafaqat/plants-growth-and-care-recommendations",
    "source_row_numbers": [
      395
    ],
    "review_status": "dataset_accepted",
    "evidence_level": "single_dataset_claim"
  },
  {
    "schema_version": "1.0.0",
    "id": "plant:amaltas_golden_shower",
    "name": "Amaltas (Golden Shower)",
    "normalized_name": "amaltas (golden shower)",
    "source_dataset_id": "kaggle:aribashafaqat/plants-growth-and-care-recommendations",
    "source_row_numbers": [
      259
    ],
    "review_status": "dataset_accepted",
    "evidence_level": "single_dataset_claim"
  },
  {
    "schema_version": "1.0.0",
    "id": "plant:amaranth",
    "name": "Amaranth",
    "normalized_name": "amaranth",
    "source_dataset_id": "kaggle:aribashafaqat/plants-growth-and-care-recommendations",
    "source_row_numbers": [
      396
    ],
    "review_status": "dataset_accepted",
    "evidence_level": "single_dataset_claim"
  },
  {
    "schema_version": "1.0.0",
    "id": "plant:anemone",
    "name": "Anemone",
    "normalized_name": "anemone",
    "source_dataset_id": "kaggle:aribashafaqat/plants-growth-and-care-recommendations",
    "source_row_numbers": [
      49
    ],
    "review_status": "dataset_accepted",
    "evidence_level": "single_dataset_claim"
  },
  {
    "schema_version": "1.0.0",
    "id": "plant:angelonia",
    "name": "Angelonia",
    "normalized_name": "angelonia",
    "source_dataset_id": "kaggle:aribashafaqat/plants-growth-and-care-recommendations",
    "source_row_numbers": [
      550
    ],
    "review_status": "dataset_accepted",
    "evidence_level": "single_dataset_claim"
  },
  {
    "schema_version": "1.0.0",
    "id": "plant:anigozanthos_kangaroo_paw",
    "name": "Anigozanthos (Kangaroo Paw)",
    "normalized_name": "anigozanthos (kangaroo paw)",
    "source_dataset_id": "kaggle:aribashafaqat/plants-growth-and-care-recommendations",
    "source_row_numbers": [
      397
    ],
    "review_status": "dataset_accepted",
    "evidence_level": "single_dataset_claim"
  },
  {
    "schema_version": "1.0.0",
    "id": "plant:apple_tree",
    "name": "Apple Tree",
    "normalized_name": "apple tree",
    "source_dataset_id": "kaggle:aribashafaqat/plants-growth-and-care-recommendations",
    "source_row_numbers": [
      344
    ],
    "review_status": "dataset_accepted",
    "evidence_level": "single_dataset_claim"
  },
  {
    "schema_version": "1.0.0",
    "id": "plant:aquilegia_columbine",
    "name": "Aquilegia (Columbine)",
    "normalized_name": "aquilegia (columbine)",
    "source_dataset_id": "kaggle:aribashafaqat/plants-growth-and-care-recommendations",
    "source_row_numbers": [
      399
    ],
    "review_status": "dataset_accepted",
    "evidence_level": "single_dataset_claim"
  },
  {
    "schema_version": "1.0.0",
    "id": "plant:armeria_thrift",
    "name": "Armeria (Thrift)",
    "normalized_name": "armeria (thrift)",
    "source_dataset_id": "kaggle:aribashafaqat/plants-growth-and-care-recommendations",
    "source_row_numbers": [
      551
    ],
    "review_status": "dataset_accepted",
    "evidence_level": "single_dataset_claim"
  },
  {
    "schema_version": "1.0.0",
    "id": "plant:arum_lily",
    "name": "Arum Lily",
    "normalized_name": "arum lily",
    "source_dataset_id": "kaggle:aribashafaqat/plants-growth-and-care-recommendations",
    "source_row_numbers": [
      400
    ],
    "review_status": "dataset_accepted",
    "evidence_level": "single_dataset_claim"
  },
  {
    "schema_version": "1.0.0",
    "id": "plant:astilbe",
    "name": "Astilbe",
    "normalized_name": "astilbe",
    "source_dataset_id": "kaggle:aribashafaqat/plants-growth-and-care-recommendations",
    "source_row_numbers": [
      118
    ],
    "review_status": "dataset_accepted",
    "evidence_level": "single_dataset_claim"
  },
  {
    "schema_version": "1.0.0",
    "id": "plant:azalea",
    "name": "Azalea",
    "normalized_name": "azalea",
    "source_dataset_id": "kaggle:aribashafaqat/plants-growth-and-care-recommendations",
    "source_row_numbers": [
      62
    ],
    "review_status": "dataset_accepted",
    "evidence_level": "single_dataset_claim"
  },
  {
    "schema_version": "1.0.0",
    "id": "plant:aztec_lily",
    "name": "Aztec Lily",
    "normalized_name": "aztec lily",
    "source_dataset_id": "kaggle:aribashafaqat/plants-growth-and-care-recommendations",
    "source_row_numbers": [
      401
    ],
    "review_status": "dataset_accepted",
    "evidence_level": "single_dataset_claim"
  },
  {
    "schema_version": "1.0.0",
    "id": "plant:bacheloratms_button",
    "name": "Bachelorâ€™s Button",
    "normalized_name": "bachelorâ€™s button",
    "source_dataset_id": "kaggle:aribashafaqat/plants-growth-and-care-recommendations",
    "source_row_numbers": [
      230
    ],
    "review_status": "dataset_accepted",
    "evidence_level": "single_dataset_claim"
  },
  {
    "schema_version": "1.0.0",
    "id": "plant:bamboo",
    "name": "Bamboo",
    "normalized_name": "bamboo",
    "source_dataset_id": "kaggle:aribashafaqat/plants-growth-and-care-recommendations",
    "source_row_numbers": [
      71
    ],
    "review_status": "dataset_accepted",
    "evidence_level": "single_dataset_claim"
  },
  {
    "schema_version": "1.0.0",
    "id": "plant:banana_plant",
    "name": "Banana Plant",
    "normalized_name": "banana plant",
    "source_dataset_id": "kaggle:aribashafaqat/plants-growth-and-care-recommendations",
    "source_row_numbers": [
      347
    ],
    "review_status": "dataset_accepted",
    "evidence_level": "single_dataset_claim"
  },
  {
    "schema_version": "1.0.0",
    "id": "plant:banyan_tree_bargad",
    "name": "Banyan Tree (Bargad)",
    "normalized_name": "banyan tree (bargad)",
    "source_dataset_id": "kaggle:aribashafaqat/plants-growth-and-care-recommendations",
    "source_row_numbers": [
      255
    ],
    "review_status": "dataset_accepted",
    "evidence_level": "single_dataset_claim"
  },
  {
    "schema_version": "1.0.0",
    "id": "plant:barberry",
    "name": "Barberry",
    "normalized_name": "barberry",
    "source_dataset_id": "kaggle:aribashafaqat/plants-growth-and-care-recommendations",
    "source_row_numbers": [
      403
    ],
    "review_status": "dataset_accepted",
    "evidence_level": "single_dataset_claim"
  },
  {
    "schema_version": "1.0.0",
    "id": "plant:bay_laurel",
    "name": "Bay Laurel",
    "normalized_name": "bay laurel",
    "source_dataset_id": "kaggle:aribashafaqat/plants-growth-and-care-recommendations",
    "source_row_numbers": [
      139
    ],
    "review_status": "dataset_accepted",
    "evidence_level": "single_dataset_claim"
  },
  {
    "schema_version": "1.0.0",
    "id": "plant:bearded_iris",
    "name": "Bearded Iris",
    "normalized_name": "bearded iris",
    "source_dataset_id": "kaggle:aribashafaqat/plants-growth-and-care-recommendations",
    "source_row_numbers": [
      552
    ],
    "review_status": "dataset_accepted",
    "evidence_level": "single_dataset_claim"
  },
  {
    "schema_version": "1.0.0",
    "id": "plant:bee_balm",
    "name": "Bee Balm",
    "normalized_name": "bee balm",
    "source_dataset_id": "kaggle:aribashafaqat/plants-growth-and-care-recommendations",
    "source_row_numbers": [
      126
    ],
    "review_status": "dataset_accepted",
    "evidence_level": "single_dataset_claim"
  },
  {
    "schema_version": "1.0.0",
    "id": "plant:beetroot",
    "name": "Beetroot",
    "normalized_name": "beetroot",
    "source_dataset_id": "kaggle:aribashafaqat/plants-growth-and-care-recommendations",
    "source_row_numbers": [
      348
    ],
    "review_status": "dataset_accepted",
    "evidence_level": "single_dataset_claim"
  },
  {